"FEHB001";"Prélèvement de sang artériel, par voie transcutanée";"";"1";"0";"9.6";"Acte remboursable";"Acte pouvant etre exonere par la regle du seuil mais n'exonerant pas la facture";"ATM - Acte technique medical;"
"EDQH005";"Artériographie sélective et/ou hypersélective de plusieurs branches extradigestives de l'aorte abdominale ou de plusieurs branches de l'artère iliaque interne, par voie artérielle transcutanée";"Note : Artériographie sélective et/ou hypersélective des artères rénales, par voie artérielle transcutanée";"1";"0";"240.0";"Acte remboursable";"Acte pouvant etre exonere par la regle du seuil et exonerant alors la facture";"ADI - Acte d imagerie;"
"DEQP002";"Électrocardiographie à haute amplification";"";"1";"0";"14.52";"Acte remboursable";"Acte pouvant etre exonere par la regle du seuil mais n'exonerant pas la facture";"ATM - Acte technique medical;"
"EFQM001";"Échographie-doppler des veines des membres supérieurs";"Notes : Avec ou sans :  - échographie-doppler des veines brachiocéphaliques  - manoeuvres dynamiquesFacturation : ne peut pas être facturé avec échodoppler des artères des membres supérieurs";"1";"0";"69.93";"Acte remboursable";"Acte pouvant etre exonere par la regle du seuil mais n'exonerant pas la facture";"ADE - Acte d echographie;"
"DKRP005";"Séance de réentraînement d'un insuffisant cardiaque à l'effort sur machine";"Notes : Avec ou sans : réentraînement - à la réalisation de tâches de la vie quotidienne - à l'activité sportive collectiveEnvironnement : la rééducation cardiaque doit être réalisée dans une salle disposant de moyens de réanimation, dans un établissement de soins comportant une unité de soins intensifs cardiologiques, une unité de réanimation ou une salle de surveillance postinterventionnelle, ou dans établissement de réadaptation des cardiaques disposant d'une salle de réanimation.";"1";"0";"28.8";"Acte remboursable";"Acte pouvant etre exonere par la regle du seuil et exonerant alors la facture";"ATM - Acte technique medical;"
"DGQH001";"Artériographie globale de l'aorte abdominale et des membres inférieurs, par voie artérielle transcutanée";"Note : Avec ou sans : artériographie des artères rénales";"1";"0";"240.0";"Acte remboursable";"Acte pouvant etre exonere par la regle du seuil et exonerant alors la facture";"ADI - Acte d imagerie;"
"ZBQK002";"Radiographie du thorax";"Notes : Radiographie pulmonaireÀ l'exclusion de : radiographie du squelette du thorax (LJQK001)Indications : selon rapport d'évaluation technologique "Principales indications et "non indications" de la radiographie du thorax" - HAS - février 2009Facturation : la radiographie du thorax ne peut pas être facturée dans les situations de "non-indication", notamment : infections des voies aériennes hautes ; hypertension artérielle ; suivi périodique de l'insuffisance cardiaque congestive chronique et des cardiomyopathies ; en préopératoire de chirurgie non cardiothoracique chez les adultes de moins de 60 ans sans pathologie cardio-pulmonaire ou...Lire la suite de la note";"1";"0";"21.28";"Acte remboursable";"Acte pouvant etre exonere par la regle du seuil mais n'exonerant pas la facture";"ADI - Acte d imagerie;"
"DKRP002";"Séance de réentraînement cardiaque et/ou vasculaire progressif à l'effort sur machine, à la réalisation de tâches de la vie quotidienne et à l'activité sportive collective";"Notes : À l'exclusion de : séance de réentraînement d'un insuffisant cardiaque à l'effort sur machine (DKRP005)Environnement : la rééducation cardiaque doit être réalisée dans une salle disposant de moyens de réanimation, dans un établissement de soins comportant une unité de soins intensifs cardiologiques, une unité de réanimation ou une salle de surveillance postinterventionnelle, ou dans établissement de réadaptation des cardiaques disposant d'une salle de réanimation.Facturation : réentraînement cardiaque";"1";"0";"28.8";"Acte remboursable";"Acte pouvant etre exonere par la regle du seuil et exonerant alors la facture";"ATM - Acte technique medical;"
"DELF007";"Implantation souscutanée d'un stimulateur cardiaque définitif, avec pose d'une sonde intraatriale ou intraventriculaire droite par voie veineuse transcutanée";"Notes : Implantation d'un stimulateur cardiaque définitif à simple chambre, pour stimulation atriale ou ventriculaire droiteFormation : spécifique à cet acte en plus de la formation initiale ; recommandations françaises et internationales de bonne pratique de la stimulation cardiaqueEnvironnement : spécifique ; recommandations françaises et internationales de bonne pratique de la stimulation cardiaque";"1";"0";"239.46";"Acte remboursable";"Acte pouvant etre exonere par la regle du seuil et exonerant alors la facture";"ATM - Acte technique medical;"
