"QCJA001";"Parage et/ou suture de plaie profonde de la peau et des tissus mous de la main";"";"1";"0";"62.7";"Acte remboursable";"Acte pouvant etre exonere par la regle du seuil et exonerant alors la facture";"ADC - Actes de chirurgie;"
"PAGA011";"Ablation de matériel d'ostéosynthèse des membres sur un site, par abord direct";"Note : À l'exclusion de : ablation par abord direct, de matériel d'ostéosynthèse  - centromédullaire des membres sur un site (PAGA010)  - de la scapula (MAGA001)  - de la main (MDGA002)  - de l'acétabulum ou de l'os coxal (NAGA001)  - du fémur (NBGA007)  - du pied (NDGA003)";"1";"0";"115.12";"Acte remboursable";"Acte pouvant etre exonere par la regle du seuil et exonerant alors la facture";"ADC - Actes de chirurgie;"
"QEMA013";"Mastoplastie bilatérale de réduction";"Note : Indication : hypertrophie mammaire caractérisée,  - responsable de dorsalgies, retentissement psychologique, - justifiable par photographie préopératoire, - étayée par : taille, poids, âge de la patiente et taille du soutien gorge - dont la résection prévue en préopératoire est d'au moins 300 g. par sein opéré.";"4";"0";"151.36";"Acte remboursable ou non suivant circonstances";"Acte pouvant etre exonere par la regle du seuil et exonerant alors la facture";"ADA - Acte d anesthesie;"
"HHFA006";"Colectomie gauche avec libération de l'angle colique gauche, avec rétablissement de la continuité, par laparotomi";"Notes : Hémicolectomie gauche avec rétablissement de la continuité, par laparotomieColectomie segmentaire basse [Résection du côlon sigmoïde] avec abaissement de l'angle gauche avec rétablissement de la continuité, par laparotomieAvec ou sans : résection du rectum ne dépassant pas le cul-de-sac de Douglas";"4";"0";"274.2";"Acte remboursable";"Acte pouvant etre exonere par la regle du seuil et exonerant alors la facture";"ADA - Acte d anesthesie;"
"JGFA006";"Vésiculoprostatectomie totale, par laparotomie";"";"1";"0";"849.98";"Acte remboursable";"Acte pouvant etre exonere par la regle du seuil et exonerant alors la facture";"ADC - Actes de chirurgie;"
"LMMA001";"Cure bilatérale d'une hernie de l'aine avec pose de prothèse, par abord inguinal";"";"4";"0";"140.22";"Acte remboursable";"Acte pouvant etre exonere par la regle du seuil et exonerant alors la facture";"ADA - Acte d anesthesie;"
"HKPA004";"Mise à plat d'abcès et/ou de fistule bas de l'anus [transsphinctérien inférieur] en un temps, par fistulotomie ou fistulectomie";"";"4";"0";"57.69";"Acte remboursable";"Acte pouvant etre exonere par la regle du seuil et exonerant alors la facture";"ADA - Acte d anesthesie;"
"HKFA005";"Excision d'une fissure et/ou d'une sténose anale, avec anoplastie muqueuse";"";"1";"0";"141.18";"Acte remboursable";"Acte pouvant etre exonere par la regle du seuil et exonerant alors la facture";"ADC - Actes de chirurgie;"
"ZCJC001";"Évacuation de collection intraabdominale, par coelioscopie ou par rétropéritonéoscopie";"";"4";"0";"134.99";"Acte remboursable";"Acte pouvant etre exonere par la regle du seuil et exonerant alors la facture";"ADA - Acte d anesthesie;"
"EDAF003";"Dilatation intraluminale de l'artère iliaque commune et/ou de l'artère iliaque externe avec pose d'endoprothèse, par voie artérielle transcutanée";"";"4";"0";"94.05";"Acte remboursable";"Acte pouvant etre exonere par la regle du seuil et exonerant alors la facture";"ADA - Acte d anesthesie;"
"EJQM004";"Échographie-doppler des veines des membres inférieurs et des veines iliaques, sans marquage cutané";"Notes : Avec ou sans : échographie-doppler de la veine cave inférieureÀ l'exclusion de : échographie-doppler des veines des membres inférieurs et des veines iliaques, pour recherche de thrombose veineuse profonde (EJQM003)Facturation : peut être facturé avec échographie-doppler des artères iliaques et des artères des membres inférieurs (EDQM001) lors du diagnostic d'un ulcère de jambe à prédominance veineuse lorsque l'IPS est inférieur à 0,9 ou supérieur à 1,3 et/ou lorsqu'il existe une discordance entre l'examen clinique et l'IPS, selon l'avis du 16 juillet 2014 de la Haute autorité de santé [HAS]";"1";"0";"69.93";"Acte remboursable";"Acte pouvant etre exonere par la regle du seuil mais n'exonerant pas la facture";"ADE - Acte d echographie;"
"EJGA003";"Extraction [Stripping] de la grande veine saphène et de la petite veine saphène, par abord direct";"Notes : Éveinage saphène interne et externe avec crossectomie, par abord directAvec ou sans : exérèse, ligature ou sclérose de veine variqueuse et/ou de la portion terminale de veine surale [jumelle]                       ligature de veine perforante";"4";"0";"80.1";"Acte remboursable";"Acte pouvant etre exonere par la regle du seuil et exonerant alors la facture";"ADA - Acte d anesthesie;"
"JEAD001";"Dilatation de sténose de l'urètre à l'aveugle";"";"1";"0";"49.23";"Acte remboursable";"Acte pouvant etre exonere par la regle du seuil et exonerant alors la facture";"ATM - Acte technique medical;"
"HFMC008";"Repositionnement ou ablation d'un anneau ajustable périgastrique, par coelioscopie";"Notes : Formation : spécifique à cet acte en plus de la formation initialeEnvironnement : spécifiqueRecueil prospectif de données : nécessaire";"1";"0";"600.2";"Acte remboursable";"Acte pouvant etre exonere par la regle du seuil et exonerant alors la facture";"ADC - Actes de chirurgie;"
"JHMA001";"Plastie du prépuce du pénis [Posthoplastie]";"Note : À l'exclusion de : - section ou plastie du frein du prépuce du pénis (JHPA001) - reconstruction du prépuce du pénis (JHMA003)";"1";"0";"62.7";"Acte remboursable";"Acte pouvant etre exonere par la regle du seuil et exonerant alors la facture";"ADC - Actes de chirurgie;"
"ZCQJ003";"Échographie du petit bassin [pelvis] féminin, par voie rectale et/ou vaginale [par voie cavitaire]";"";"1";"0";"52.45";"Acte remboursable";"Acte pouvant etre exonere par la regle du seuil mais n'exonerant pas la facture";"ADE - Acte d echographie;"
"JKNE001";"Abrasion de la muqueuse de l'utérus [Endométrectomie], par hystéroscopie";"Note : Avec ou sans : résection de polype";"4";"0";"83.6";"Acte remboursable";"Acte pouvant etre exonere par la regle du seuil et exonerant alors la facture";"ADA - Acte d anesthesie;"
"JKFA028";"Hystérectomie totale avec annexectomie unilatérale ou bilatérale, par laparotomie";"";"1";"0";"323.09";"Acte remboursable";"Acte pouvant etre exonere par la regle du seuil et exonerant alors la facture";"ADC - Actes de chirurgie;"
"HKPA005";"Mise à plat d'abcès et/ou de fistule intersphinctérien haut [intramural] de l'anus";"";"4";"0";"59.57";"Acte remboursable";"Acte pouvant etre exonere par la regle du seuil et exonerant alors la facture";"ADA - Acte d anesthesie;"
"ZZQL010";"Détection peropératoire de lésion après injection de produit radio-isotopique";"Note : Recherche peropératoire de ganglion sentinelle";"1";"0";"44.22";"Acte remboursable";"Acte pouvant etre exonere par la regle du seuil et exonerant alors la facture";"ADI - Acte d imagerie;"
"EZMA001";"Création d'une fistule artérioveineuse pour accès vasculaire par abord direct sans superficialisation veineuse, chez un sujet de plus de 20 kg";"";"4";"0";"122.88";"Acte remboursable";"Acte pouvant etre exonere par la regle du seuil et exonerant alors la facture";"ADA - Acte d anesthesie;"
"ZCQJ006";"Échographie transcutanée avec échographie par voie rectale et/ou vaginale [par voie cavitaire] du petit bassin [pelvis] féminin";"";"1";"0";"56.7";"Acte remboursable";"Acte pouvant etre exonere par la regle du seuil mais n'exonerant pas la facture";"ADE - Acte d echographie;"
"MJPA013";"Section ou plastie d'agrandissement de la partie cruciforme de la gaine fibreuse digitale [poulie de réflexion de tendon de muscle fléchisseur des doigts] sur un rayon de la main, par abord direct";"Note : Traitement chirurgical du doigt à ressaut";"4";"0";"57.31";"Acte remboursable";"Acte pouvant etre exonere par la regle du seuil et exonerant alors la facture";"ADA - Acte d anesthesie;"
